{
  "schemaVersion": "1.0.0",
  "planId": "mz.systems.release.production-01-plan",
  "taskId": "TASK-PORT-01-RELEASE-BOUNDARY",
  "status": "complete",
  "outputStatus": "release-plan",
  "productionAuthority": false,
  "generatedRelease": false,
  "targetPackage": {
    "name": "@mez-systems/design-system-web",
    "candidateVersion": "1.0.0-rc.1",
    "productionVersion": "1.0.0",
    "productionVersionEligibility": "Only after authority reconciliation, CMP-05/CMP-06 disposition, redacted proof review, isolated package proof and named consumer proof pass.",
    "entrypoints": [
      "styles/index.css",
      "runtime/index.js",
      "components/index.js",
      "golden/homepage/index.html",
      "package.json",
      "manifest.json",
      "verify.py"
    ],
    "requiredGroups": [
      "authority",
      "foundations",
      "identity",
      "runtime",
      "expressions",
      "components",
      "golden-homepage",
      "guidance",
      "skills",
      "schemas",
      "validators",
      "examples",
      "licences"
    ]
  },
  "dependencyClasses": [
    "canonical",
    "generated",
    "evidence-only",
    "consumer-owned"
  ],
  "inventoryGranularity": "Each entry is one release-copy unit or one explicitly external ownership unit. Runtime references are additionally traced by verify_release_boundary.py.",
  "dependencies": [
    {
      "id": "DEP-AUTHORITY-CONTROL-PLANE",
      "class": "canonical",
      "status": "active",
      "source": "brand-kit/authority/",
      "releaseTreatment": "Copy the active authority manifest and bounded approval records into an immutable package authority snapshot after ledger reconciliation.",
      "includeInTarget": true,
      "followUp": "TASK-PORT-02-HOMEPAGE-DEPENDENCY-GATES"
    },
    {
      "id": "DEP-GOVERNANCE-DECISION-LEDGER",
      "class": "canonical",
      "status": "release-eligible",
      "source": "brand-kit/governance/post-cutover-decisions.json",
      "releaseTreatment": "Copy the immutable cutover ledger and its reconciled post-cutover supplement into the package authority snapshot, retaining every cited bounded approval source.",
      "includeInTarget": true,
      "followUp": "TASK-PORT-03-PRODUCTION-RELEASE-ASSEMBLY"
    },
    {
      "id": "DEP-FOUNDATIONS-1-0-0",
      "class": "canonical",
      "status": "release-eligible",
      "source": "brand-kit/releases/foundations/dist/",
      "releaseTreatment": "Copy byte-for-byte with fonts, licences, manifests and ordered CSS entrypoint.",
      "includeInTarget": true,
      "followUp": "TASK-PORT-03-PRODUCTION-RELEASE-ASSEMBLY"
    },
    {
      "id": "DEP-IDENTITY-MIGRATION-SNAPSHOT",
      "class": "generated",
      "status": "reference-input-not-nested-release",
      "source": "brand-kit/releases/0.1.0-alpha.1/",
      "releaseTreatment": "Use its verified identity data, renderer, palettes and assets as assembly inputs; do not nest or relabel the migration snapshot as production-ready.",
      "includeInTarget": false,
      "followUp": "TASK-PORT-03-PRODUCTION-RELEASE-ASSEMBLY"
    },
    {
      "id": "DEP-PRODUCT-REGISTRY",
      "class": "canonical",
      "status": "release-eligible",
      "source": "brand-kit/registry/products.json",
      "releaseTreatment": "Copy into package identity data with its source hash and schema.",
      "includeInTarget": true,
      "followUp": "TASK-PORT-03-PRODUCTION-RELEASE-ASSEMBLY"
    },
    {
      "id": "DEP-GRADIENT-CATALOGUE-AND-STATIC-TWINS",
      "class": "generated",
      "status": "release-eligible-derived",
      "source": "brand-kit/gradient-library/catalogue.json",
      "releaseTreatment": "Generate the package catalogue, runtime palettes and exact static twins from canonical source authority; retain integrity and provenance.",
      "includeInTarget": true,
      "followUp": "TASK-PORT-03-PRODUCTION-RELEASE-ASSEMBLY"
    },
    {
      "id": "DEP-LIVING-CORE-RUNTIME",
      "class": "canonical",
      "status": "release-eligible",
      "source": "brand-kit/source-pack/design-system-export/mz-core.js",
      "releaseTreatment": "Copy the approved shared renderer with local palette data and no canonical-checkout import.",
      "includeInTarget": true,
      "followUp": "TASK-PORT-03-PRODUCTION-RELEASE-ASSEMBLY"
    },
    {
      "id": "DEP-WINGS-ASSET",
      "class": "canonical",
      "status": "release-eligible",
      "source": "brand-kit/source-pack/design-system-export/assets/wings.svg",
      "releaseTreatment": "Copy the exact two-path asset once and reference the package-local URL.",
      "includeInTarget": true,
      "followUp": "TASK-PORT-03-PRODUCTION-RELEASE-ASSEMBLY"
    },
    {
      "id": "DEP-EXPRESSION-SUITE",
      "class": "canonical",
      "status": "release-eligible-bounded",
      "source": "brand-kit/expressions/",
      "releaseTreatment": "Package approved disc, sphere, Wings/mark, Product Card, Trading Card, Website Motion and Expression Stress contracts with their schemas, validators, guidance and examples; retain each scope boundary.",
      "includeInTarget": true,
      "followUp": "TASK-PORT-03-PRODUCTION-RELEASE-ASSEMBLY"
    },
    {
      "id": "DEP-GLOBAL-NAVIGATION-1-0-0",
      "class": "canonical",
      "status": "release-eligible",
      "source": "brand-kit/releases/components/global-navigation/1.0.0/",
      "releaseTreatment": "Consume the deterministic component release rather than the workbench-relative source import.",
      "includeInTarget": true,
      "followUp": "TASK-PORT-03-PRODUCTION-RELEASE-ASSEMBLY"
    },
    {
      "id": "DEP-GOLDEN-HOMEPAGE-CONTRACT",
      "class": "canonical",
      "status": "canonical-design-unreleased",
      "source": "brand-kit/golden/homepage/",
      "releaseTreatment": "Copy the approved Round 28 source, schema, review, approval, composition and accessibility contracts without claiming consumer routes or deployment authority.",
      "includeInTarget": true,
      "followUp": "TASK-PORT-03-PRODUCTION-RELEASE-ASSEMBLY"
    },
    {
      "id": "DEP-GOLDEN-HOMEPAGE-IMPLEMENTATION",
      "class": "canonical",
      "status": "canonical-reference-requires-rebasing",
      "source": "brand-kit/workbench/golden/homepage/",
      "releaseTreatment": "Copy only the approved page-local HTML, CSS and JavaScript after rebasing every import to package entrypoints; exclude review controls, labs and raw evidence media.",
      "includeInTarget": true,
      "followUp": "TASK-PORT-03-PRODUCTION-RELEASE-ASSEMBLY"
    },
    {
      "id": "DEP-THIRD-PARTY-MARKS",
      "class": "evidence-only",
      "status": "reference-assets-production-authority-false",
      "source": "brand-kit/assets/third-party-marks/",
      "releaseTreatment": "Copy only the sixteen referenced mark assets plus attribution/provenance if legal review permits; never copy the full research registry by default or treat marks as Mez identity data.",
      "includeInTarget": false,
      "followUp": "TASK-PORT-03-PRODUCTION-RELEASE-ASSEMBLY"
    },
    {
      "id": "DEP-CMP-05-HALFTONE-PORTRAIT",
      "class": "canonical",
      "status": "release-eligible-approved",
      "source": "brand-kit/components/halftone-portrait/",
      "releaseTreatment": "Copy only the canonical 1.0.0 code, schema, guidance, approval and verifier. Media preparation, fixture likenesses and consumer content remain outside the component package unless separately reviewed.",
      "includeInTarget": true,
      "followUp": "TASK-PORT-03-PRODUCTION-RELEASE-ASSEMBLY"
    },
    {
      "id": "DEP-CMP-06-TESTIMONIAL-MARQUEE",
      "class": "canonical",
      "status": "release-eligible-approved",
      "source": "brand-kit/components/testimonial-marquee/",
      "releaseTreatment": "Copy the canonical 1.0.0 component machinery, schema, guidance, approval and verifier. Keep the seven-person fixture as dated example content and require consumer-owned media and consent provenance for deployment.",
      "includeInTarget": true,
      "followUp": "TASK-PORT-03-PRODUCTION-RELEASE-ASSEMBLY"
    },
    {
      "id": "DEP-TESTIMONIAL-CONTENT",
      "class": "consumer-owned",
      "status": "fixture-not-production-truth",
      "source": "brand-kit/components/testimonial-marquee/fixtures/ai-os-testimonials.json",
      "releaseTreatment": "Ship only as a clearly dated example unless the named consumer supplies and owns a production content payload with freshness and consent metadata.",
      "includeInTarget": false,
      "followUp": "TASK-PORT-04-NAMED-CONSUMER-PROOF"
    },
    {
      "id": "DEP-TESTIMONIAL-MEDIA",
      "class": "consumer-owned",
      "status": "consented-workbench-media-release-review-required",
      "source": "brand-kit/components/testimonial-marquee/fixtures/media/",
      "releaseTreatment": "Do not include by default. The consumer supplies approved public derivatives and consent provenance through the testimonial content interface.",
      "includeInTarget": false,
      "followUp": "TASK-PORT-04-NAMED-CONSUMER-PROOF"
    },
    {
      "id": "DEP-OPERATING-PROOF-RAW",
      "class": "evidence-only",
      "status": "redaction-pending-release-ineligible",
      "source": "brand-kit/workbench/golden/homepage/assets/operating-proof/",
      "releaseTreatment": "Never copy raw PNG bytes. Accept only derivatives that validate against operating-proof-payload.schema.json and carry public-release approval.",
      "includeInTarget": false,
      "followUp": "TASK-PORT-03-PRODUCTION-RELEASE-ASSEMBLY"
    },
    {
      "id": "DEP-HOMEPAGE-REVIEW-EVIDENCE",
      "class": "evidence-only",
      "status": "retain-in-authority-not-runtime",
      "source": "brand-kit/golden/homepage/round-28-gate-b.json",
      "releaseTreatment": "Include concise approval and test receipts in guidance; exclude rejected labs, feedback controls and historical workbench rounds from runtime.",
      "includeInTarget": true,
      "followUp": "TASK-PORT-03-PRODUCTION-RELEASE-ASSEMBLY"
    },
    {